{
  "id": "switch",
  "name": "Switch",
  "family": "inputs",
  "version": "1.0.0",
  "lifecycle": "stable",
  "source": "design-system/components/inputs.tsx",
  "story": "design-system/stories/Inputs.stories.tsx",
  "description": "Immediate on or off setting with explicit state.",
  "semantics": [
    "Native checkbox with switch role",
    "Visible label"
  ],
  "keyboard": [
    "Space toggles"
  ],
  "targetSize": 44,
  "dependencies": [],
  "exportName": "Switch",
  "sizes": [
    "default"
  ],
  "variants": [
    "with-description",
    "without-description"
  ],
  "states": [
    "off",
    "on",
    "focus-visible",
    "disabled"
  ],
  "accessibleName": "Required visible label prop.",
  "controlMode": "both",
  "storyExport": "SwitchContract",
  "examples": [
    "design-system/stories/Inputs.stories.tsx#SwitchContract"
  ],
  "$schema": "../../contracts/component.schema.json"
}
