{
  "id": "menu",
  "name": "Menu",
  "family": "navigation",
  "version": "1.0.0",
  "lifecycle": "stable",
  "source": "design-system/components/navigation.tsx",
  "story": "design-system/stories/Navigation.stories.tsx",
  "description": "Compact action list, standalone or opened by an optional button trigger. Dropdowns align to start or end; separatorBefore groups items. Row backgrounds highlight only on hover; keyboard focus retains the standard focus outline. Existing standalone calls remain supported.",
  "semantics": [
    "Menu and menuitem roles for application actions",
    "Button trigger exposes aria-haspopup, aria-expanded, and aria-controls",
    "Separators are not focusable"
  ],
  "keyboard": [
    "Arrow keys move past disabled items",
    "Escape closes and restores trigger focus",
    "Home and End move to edges",
    "Enter or Space opens and selects",
    "Arrow Down or Up on the trigger opens at the first or last enabled item",
    "Tab closes without trapping focus"
  ],
  "targetSize": 44,
  "dependencies": [
    "icon-button",
    "divider"
  ],
  "exportName": "Menu",
  "sizes": [
    "default"
  ],
  "variants": [
    "action-menu"
  ],
  "states": [
    "enabled",
    "disabled",
    "focus-visible",
    "long-content"
  ],
  "accessibleName": "Required label prop names the menu; visible text names each menu item.",
  "controlMode": "uncontrolled",
  "storyExport": "MenuContract",
  "examples": [
    "design-system/stories/Navigation.stories.tsx#MenuContract",
    "design-system/stories/Navigation.stories.tsx#ProfileMenuDropdown"
  ],
  "$schema": "../../contracts/component.schema.json"
}
