{
  "id": "textarea",
  "name": "Textarea",
  "family": "inputs",
  "version": "1.0.0",
  "lifecycle": "stable",
  "source": "design-system/components/inputs.tsx",
  "story": "design-system/stories/Inputs.stories.tsx",
  "description": "Labeled multiline input with help, validation, and optional count.",
  "semantics": [
    "Persistent label",
    "Help and error descriptions",
    "aria-invalid on error"
  ],
  "keyboard": [
    "Native multiline editing"
  ],
  "targetSize": 44,
  "dependencies": [
    "inline-validation"
  ],
  "exportName": "Textarea",
  "sizes": [
    "default"
  ],
  "variants": [
    "resizable"
  ],
  "states": [
    "empty",
    "filled",
    "focus-visible",
    "disabled",
    "required",
    "help",
    "error"
  ],
  "accessibleName": "Required persistent label prop.",
  "controlMode": "both",
  "storyExport": "TextareaContract",
  "examples": [
    "design-system/stories/Inputs.stories.tsx#TextareaContract"
  ],
  "$schema": "../../contracts/component.schema.json"
}
